{
  "id": "job_valid_01",
  "project_id": "proj_01",
  "type": "detect",
  "status": "succeeded",
  "stage": "detecting",
  "attempt": 1,
  "result": {
    "model_name": "yolov10_desk_fine",
    "model_version": "yolov10_desk_fine.pt",
    "run_mode": "real",
    "device": "cuda:0",
    "elapsed_seconds": 0.42,
    "image_width": 1441,
    "image_height": 1080,
    "count": 3
  },
  "detections": [
    {
      "id": "det_01",
      "class_id": 0,
      "class_name": "laptop",
      "confidence": 0.94,
      "bbox_image": [0.12, 0.3, 0.55, 0.78],
      "source": "yolov10:yolov10_desk_fine",
      "raw_class_name": null
    },
    {
      "id": "det_02",
      "class_id": 8,
      "class_name": "thermos_cup",
      "confidence": 0.87,
      "bbox_image": [0.6, 0.62, 0.68, 0.74],
      "source": "yolov10:yolov10_desk_fine",
      "raw_class_name": null
    },
    {
      "id": "det_03",
      "class_id": 23,
      "class_name": "other",
      "confidence": 0.42,
      "bbox_image": [0.7, 0.2, 0.82, 0.5],
      "source": "yolo-world",
      "raw_class_name": "tablet"
    }
  ],
  "error": null,
  "created_at": "2026-10-11T08:00:00+00:00",
  "updated_at": "2026-10-11T08:00:01+00:00"
}
